{
  "schema_version": "1",
  "id": "plan_class_g7a_demo_lesson_g7_inverse_proportion_01",
  "class_id": "class_g7a_demo",
  "lesson_id": "lesson_g7_inverse_proportion_01",
  "status": "draft",
  "total_duration_minutes": 45,
  "activities": [
    {
      "id": "act_class_g7a_demo_lesson_g7_inverse_proportion_01_confirm",
      "title": "Khởi động xác nhận mức sẵn sàng",
      "duration_minutes": 5,
      "root_cause_skill_id": "skill_ratio_proportion_basics",
      "skill_id": "skill_ratio_proportion_basics",
      "expected_evidence": "Mỗi nhóm can thiệp hoàn thành một câu ngắn để xác nhận nhu cầu tiên quyết đã chẩn đoán.",
      "rationale": "Xác nhận ưu tiên số 1 trước khi dạy: score=0.5892; prevalence=0.1000 (4/40); downstream_impact=0.9167; lesson_urgency=0.8500; diagnostic_confidence=1.0000"
    },
    {
      "id": "act_class_g7a_demo_lesson_g7_inverse_proportion_01_repair",
      "title": "Củng cố tiên quyết có hướng dẫn",
      "duration_minutes": 15,
      "root_cause_skill_id": "skill_ratio_proportion_basics",
      "skill_id": "skill_ratio_proportion_basics",
      "expected_evidence": "Một ví dụ mẫu và một bài có hướng dẫn thể hiện đúng chiến lược tiên quyết.",
      "rationale": "Dành thời lượng hướng dẫn dài nhất cho ưu tiên số 1 (skill_ratio_proportion_basics)."
    },
    {
      "id": "act_class_g7a_demo_lesson_g7_inverse_proportion_01_practice",
      "title": "Luyện kỹ năng mục tiêu theo nhóm",
      "duration_minutes": 15,
      "root_cause_skill_id": "skill_distinguish_direct_inverse",
      "skill_id": "skill_word_problem_work_rate",
      "expected_evidence": "Mỗi học sinh hoàn thành hai câu kỹ năng mục tiêu, gắn với nhóm can thiệp được giao.",
      "rationale": "Kết nối lại ưu tiên số 2 (skill_distinguish_direct_inverse) với mục tiêu của bài học hiện tại."
    },
    {
      "id": "act_class_g7a_demo_lesson_g7_inverse_proportion_01_transfer",
      "title": "Phiếu cuối giờ vận dụng gần",
      "duration_minutes": 10,
      "root_cause_skill_id": "skill_ratio_proportion_basics",
      "skill_id": "skill_word_problem_work_rate",
      "expected_evidence": "Một câu vận dụng gần làm độc lập để phân biệt thành công tức thời với khả năng vận dụng.",
      "rationale": "Thu thập bằng chứng có thể so sánh cho chu kỳ chẩn đoán và rà soát tiếp theo."
    }
  ],
  "generated_at": "2026-07-18T21:19:00Z"
}
